{
  "$schema": "https://json-schema.org/draft/2020-12/schema",
  "$id": "alert.schema.json",
  "title": "Alert (one sent notification)",
  "type": "object",
  "additionalProperties": false,
  "required": [
    "school_id",
    "date",
    "sent_at",
    "channel",
    "trigger",
    "subject",
    "message_id",
    "plan_generated_at"
  ],
  "properties": {
    "school_id": {
      "type": "string"
    },
    "date": {
      "type": "string",
      "pattern": "^\\d{4}-\\d{2}-\\d{2}$"
    },
    "sent_at": {
      "type": "string",
      "pattern": "^\\d{4}-\\d{2}-\\d{2}T\\d{2}:\\d{2}:\\d{2}Z$"
    },
    "channel": {
      "enum": [
        "sns-email"
      ]
    },
    "trigger": {
      "enum": [
        "schedule",
        "test"
      ]
    },
    "subject": {
      "type": "string"
    },
    "message_id": {
      "type": "string"
    },
    "plan_generated_at": {
      "type": "string",
      "pattern": "^\\d{4}-\\d{2}-\\d{2}T\\d{2}:\\d{2}:\\d{2}Z$"
    }
  }
}
