{
 "school_id": "sample-dwarka",
 "date": "2026-10-12",
 "sent_at": "2026-10-12T01:30:00Z",
 "channel": "sns-email",
 "trigger": "test",
 "subject": "[SAMPLE] Bad-Air Day Protocol 2026-10-12: PE (Classes 6-8), Dispersal indoors",
 "message_id": "00000000-0000-0000-0000-000000000000",
 "plan_generated_at": "2026-10-12T01:30:00Z"
}
